{
  "$schema": "https://x.zzbuaoye.net/schemas/hanabi/plugin-manifest-v1.schema.json",
  "manifestVersion": 1,
  "apiVersion": "1.0",
  "id": "hanabi.official.bittorrent",
  "name": "Hanabi BitTorrent",
  "version": "0.1.0",
  "author": "Hanabi Download Manager X",
  "description": "Official BitTorrent download support for magnet links and torrent files, powered by an isolated aria2 backend.",
  "category": "download",
  "entry": "main.py",
  "homepage": "https://github.com/buaoyezz/Hanabi-Download-Manager-X/tree/main/plugins/official/bittorrent",
  "repository": "https://github.com/buaoyezz/Hanabi-Download-Manager-X",
  "license": "MIT",
  "capabilities": [
    "download:magnet",
    "download:torrent_file"
  ],
  "priority": 100,
  "permissions": [
    "network",
    "file_write",
    "system_command"
  ],
  "minAppVersion": "1.5.0",
  "runtime": {
    "timeoutSeconds": 90
  }
}
